title,subject,type,method,template,date_added,buyer,seller,admin,general,status
register,Email Registration,global,email,&nbsp;&nbsp; 									Hi {{event.user}}newchar			Thank you for registering with {{event.sitename}}! .			Click&nbsp;  &nbsp;the blue link below to get started! &nbsp; &nbsp; 			&nbsp; {{event.activeurl}}			&nbsp; &nbsp;			Thank younewchar												,Thu Aug 06 2015 10:57:36 GMT+0530 (IST),1,1,0,1,1
bid_submitted,Your Bid was Submitted Succesffully,global,email,   {{event.sitename}}  Hi {{event.user}}&nbsp; Your ${{event.amount}} bid submitted successfully for {{event.title}}.We will notify you if you become a winner.Thank younewchar ,Thu Aug 06 2015 15:01:22 GMT+0530 (IST),1,0,0,0,1
project_posted,New Product is Added,global,email,Hi {{event.userName}}newcharA new product has been posted. Click on this link&nbsp;{{event.url}} for more details.Thanksnewchar,Fri Aug 07 2015 10:21:25 GMT+0530 (IST),1,1,1,0,1
winner_buyer,You are the winner !,global,email,  {{event.sitename}}  Hinewchar&nbsp;{{event.fname}} {{event.tname}}&gt;Congratulationsnewchar You’re the winning bidder!Item Title:&nbsp;{{event.title}}Item Price:${{event.price}}Item URL:&nbsp;{{event.url}}For your conveniencenewchar here is the seller's payment policy:We accept all major credit cardsnewchar Paypalnewchar and bank wires.Unless otherwise specified by the payment policy abovenewchar you must pay for the item within 72 hours to avoid a cancellation of your purchase.Terms of SaleAll sales are FINAL. Product is sold AS ISnewchar WHERE IS.Buyer is responsible for all taxesnewchar dutiesnewchar loading and freight charges.Seller offers no warranties direct or implied from manufacturer or otherwise.Title transfers from Seller to Buyer upon release to Buyer logistics provider at pick up.Buyer (or Buyer’s logistics provider) must confirm quantity and condition at pick up. Upon release of product to the Buyer and removed from Seller’s locationnewchar there will be no adjustments based on quantity or condition.What's Next After Payment?Seller will receive an email from ChemExchange upon receipt of Buyer payment. Seller will be instructed to email Buyer a pick-up/order number for issuance of product. If you haven't heard from the Seller within 72 hoursnewchar please contact us at support@chemexchange.com.Contact SellerThank younewchar{{event.sitename}} ,Fri Aug 07 2015 17:30:34 GMT+0530 (IST),1,0,0,0,1
watchlist_added,Item Successfully Added to your Watchlist,global,email,									Hi {{event.user}}			&nbsp;{{event.title}} product added to your Watchlist.			Thank younewchar												,Fri Aug 07 2015 18:21:33 GMT+0530 (IST),1,0,0,0,1
item_sold,Your Item Sold,global,email,									Hi {{event.user}}			Your Item {{event.title}}&nbsp;has sold&nbsp;successfully!			Item Title : {{event.title}}			Item&nbsp;Price : ${{event.price}}			Item&nbsp;&nbsp;Url&nbsp;: {{event.url}}			Item&nbsp;&nbsp;qty : {{event.qty}}			Buyer Name : {{event.bname}}			Buyer Email : {{event.bemail}}			Buyer Phone : {{event.bphone}}			What&#39;s Next?			You will receive an email from {{event.sitename}} upon receipt of Buyer&rsquo;s payment. Please provide a pick-up/order number to the Buyer upon receipt of this email. If you haven&#39;t heard from the Buyer within 72 hoursnewchar please contact us at support@chemexchange.com.						Thank younewchar												,Fri Aug 07 2015 19:41:23 GMT+0530 (IST),0,1,0,0,1
package_bought,Package Bought Successfully! ,global,email,&lt;meta content=&quot;text/html; charset=UTF-8&quot; http-equiv=&quot;Content-Type&quot;&gt;&nbsp; &lt;title&gt;{{event.sitename}}&lt;/title&gt;&nbsp; &lt;meta name=&quot;viewport&quot; content=&quot;width=device-widthnewchar initial-scale=1.0&quot;&gt;&lt;table cellpadding=&quot;0&quot; cellspacing=&quot;0&quot; width=&quot;600&quot;&gt;&lt;tbody&gt;&lt;tr&gt;&lt;td class=&quot;wysiwyg-tmp-selected-cell&quot;&gt;&lt;div style=&quot;margin:20px 20px;font-size:15px;font-weight:bold;width:600px;font-family:Arialnewchar Helveticanewchar sans-serif;color:#000;&quot;&gt;Hi {{event.user}}&lt;/div&gt;&lt;div style=&quot;margin:20px 20px;font-size:13px;font-weight:bold;font-family:Arialnewchar Helveticanewchar sans-serif;color:#000;&quot;&gt;You bought package succesfully&lt;/div&gt;&lt;div style=&quot;margin:20px 20px;font-size:13px;font-weight:normal;width:600px;font-family:Arialnewchar Helveticanewchar sans-serif;color:#000;&quot;&gt;Package Price : ${{event.price}}&lt;/div&gt;&lt;div style=&quot;margin:20px 20px;font-size:13px;font-weight:normal;width:600px;font-family:Arialnewchar Helveticanewchar sans-serif;color:#000;&quot;&gt;Thank younewchar&lt;br&gt;&lt;br&gt;&lt;img src=&quot;{{event.siteurl}}/images/logoc.png&quot; alt=&quot;&quot; width=&quot;160&quot;&gt;&lt;/div&gt;&lt;/td&gt;&lt;/tr&gt;&lt;/tbody&gt;&lt;/table&gt;,Fri Aug 07 2015 19:43:10 GMT+0530 (IST),1,1,1,0,1
message_sent,Messages,global,email,						&nbsp;			Hi {{event.fname}} {{event.tname}}			&nbsp;			{{event.message}}			&nbsp;						Thank younewchar															&nbsp;&nbsp;&nbsp;&nbsp;,Fri Aug 07 2015 19:46:26 GMT+0530 (IST),1,1,1,1,1
